Text,Label,hard,,
"Argentina in their first 2 matches: 5 goals all scored by Messi and haven’t conceded

They’re going back to back or what 🤯 Unreal performances",reaction,,,
Ronaldo has 5 non penalty goals in his world cup career. Messi has 5 goals through 2 games at 38 years old. 🐐,analysis,,,
Should’ve had an assist Alvarez fumbled and on the header too,reaction,,,
Most non penalty goals(5) in any of messi worldcup campaigns so far. He's 39 years old and only 2 games in,analysis,,,
Man Messi really is the whole team. Argentina needs to be better if they want to win it all.,reaction,,,
Arsenal can do without Alvarez thanks.,reaction,,,
5 goals No penalties btw,analysis,,,
They let Argentina take the free kick but not cape Verde ,reaction,,,
"the golden boot comp is already over after two games 💀
",reaction,,,
"Messi really has a solution for everything lol. If you fail once, try again, then try again, then once more. Actually just give it to Messi",reaction,,,
"13 goals over his last 6 WC games.

LMFAO. Who tf is doing this?",reaction,,,
"39 is the new 35, messi, lebron, pacquiao, brady",analysis,,,
"Argentina depending on old Messi to carry will get a reality check in round of 16. Algeria, Austria, and Jordan were never going to be a challenge tbh.",hot take,,,
Shout out to Austria's #4 who was slowly jogging back behind the play while Messi sprinted upfield and failed to get back to defend against that goal. When the goal happened he was bent over at the 18 with his hands on his knees. Austria's whole team looked gassed on that play while Messi was still going at 100%,analysis,,,
Bold defensive strategy by Austria to just stand still in front of the net while the most prolific goal scorer in the world has the ball in the box,reaction,,,
I think the “own goal” distinction in football is dumb. Like in hockey if the defense tips it in on accident it goes to the player that shot it. An own goal should be like if they go for a goalie pass and whiff it,analysis,,,
That’s 5 goals for Messi in this WC. ZERO for the rest of the Argentina team. This is a one man show!!!!,analysis,,,
Argentina wouldn’t be as goated without Messi,hot take,,,
Messi is the real deal.,reaction,,,
Ronaldo will avenge Austria by preventing a Portugal victory next game.,hot take,,,
I will laugh from a deep healthy place tomorrow if Ronaldo gets too greedy for the finish and blows the Portugal win against Uzbekistan. I think itd be good for my health to laugh that hard seeing him do his little wince and shoulder shrug after he bombs every shot over the stands. And by no means do I want to see Portugal lose.,hot take,,,
"Argentina are lucky they have Messi, he is literally the entire team. Total respect to him but they have to do better if they want to win the whole thing imo",analysis,,,
History was made in this game. Messi is #1 goal maker of all time. Now in a Worls Cup,analysis,,,
All 5 goals scored by because other finishers not that good,analysis,,,
"Do the argentinians deserve it? no. Does austria have any excuses? No. Did the Ref rigg the game, absolutely.",reaction,,,
"messi created a chance, gave an assist then guy missed it but messi didn't, this is what makes Messi a lot different than Ronaldo",analysis,,,
Argentina without Messi will have a big problem in the future,analysis,,,
"I am shocked 4 years ago people wondered if this guy could win it all. I love watching Argentina. I dont know what it is, but it’s exactly how I was taught to play soccer. I see thier runs and the field open up, and it just speaks to me.",reaction,,,
Messi makes scoring goals look easy ,reaction,,,
"Those austrian players looked like deer caught in the Messi headlights.
Complete panic and frozen in fear as Messi wandered around in their box.",reaction,,,
"
Of all the goats, Messi the most Goated",reaction,,,
Well thank you Argentina for beating the spread and Messi getting 2+ goals.,reaction,,,
"
This 38 years and 363 days old man just scored against a GK and four defenders, wtf.",reaction,,,
The Messi Ronaldo debate should end after this WC,reaction,,,
"
Mbappé will have way more WC goals by the end of his career.",hot take,,,
Ronaldo is gonna crash out after seeing this,reaction,,,
Messi is undeniably the best. 5 goals. 5. Goals.,reaction,,,
"Apart from messi, their finishing is terrible",analysis,,,
"Everyone knew with the expanded format that the traditional powerhouses like Germany, Brazil, and Canada would be able to put up big wins like that.",analysis,,,
Fun fact they beat Haiti 7-1 ten years ago during Copa America,analysis,,,
40 G/A for Vini this season,analysis,,,
Paqueta is playing like a boss in the midfield.,reaction,,,
"Was at an el classico watch party in Atlanta a few years ago. Tons of Spanish expats 60% real, 40% Barca. A TON of banter, because they mostly all knew each other. Messi scored at the death to win and a kid this age in a Real jersey was bawling and trying to hide it. A couple guys in Barca jersies were really working to make him feel better.",analysis,,,
Uzbek was playing a low block for 80 minutes until they decided to begin shooting. They were playing to not lose which is a recipe for *checks notes* losing. Their lone goal was a lucky break from a sloppy save by Vargas.,analysis,,,
My guess for all 4 upcoming matches today Czechia winning against south africa 2-1 Switzerland beating Bosnia 2-1 Canada beatign Qatar 2-1 and Mexico beating South korea 2-1,analysis,,,
South Africa will win or draw. Switz will beat bosnia. Canada will beat or draw and south korea will beat Mexico,hot take,,,
Colombia looked really convincing here. 61% possession and 15 shots tells the full story — Uzbekistan simply couldn't handle the pressing intensity. Campaz sealing it at 90' was the cherry on top. Great start for Colombia in Group K.,analysis,,,
"Uzbekistan had solid passages in the second half after being too passive in the first. Colombia had their moments and took advantage of them. They also had a higher quality of players but Lorenzo's tactics, James, and not making subs is going to limit their potential",analysis,,,
Colombia have two of the top 3 so far IMO.,hot take,,,
"Uzbekistans true ranking would be around 20-30, so it is expected of colombia to struggle and not have a comfortable game",analysis,,,
"That was just beautiful. Best game, final sequence, and energy I've seen this cup. Glory to Uzbekistan and congrats to Colombia!",reaction,,,
Those last ten minutes ... almost could've been a 3-2 UZB win. Theoretically.,reaction,,,
"UZB is not a serious team in this tournament but quite frankly this is what you have to do to them if you’re COL it really should’ve been sooner, they will probably go out to a top team but they should win this group now and then go out quietly to Argentina in the quarterfinal",analysis,,,
"A win for Colombia, but Vargas antics struck again. Not to mention James wasn’t great either.",analysis,,,
"3-1 flatters Colombia, a more experienced team would have won that",analysis,,,
Probably the most fun match I watched today.,reaction,,,
What a disorganized defense. If that were a good team we wouldn't have won,analysis,,,
"Goodness gracious, Colombia with the two best assists of the tournament in a single game",reaction,,,
Portugal gonna finish 2nd in the group,hot take,,,
"This tournament has the Columbus Crew, Ohio’s MLS club, written all over it",hot take,,,
England’s World Cup experiences will still be better than that of most countries bar a small number of 4-5 teams.,analysis,,,
Vini be cooking!!! 2 assists and a goal! Yeah boi!,reaction,,,
"So the defensive line is standing so high that Haiti's back 4 are at the halfway line and their goalkeeper is just chilling in the 5m box and this against a team with speedy runners?

Yeah glad Brazil punished them for this",analysis,,,
"Nothing to sorry about, Brazil needs to ramp up the score line as much as they can tbh",analysis,,,
It's a beautiful finish as well. Finally Brazil can display their individual quality - but can they do it against a better opponent?,analysis,,,
it's disappointing. 54 years since our last WC at least I got to watch it with my dad who always talked about our first WC appearance. I wished they could've given us a goal to give us some kind of hope. We need start actually start developing talent from a young age instead of having to convince diaspora who can't get into another countries squad. Start some academies and start developing an identity as a nation on the field.,reaction,,,
Thing I learned tonight which I found crazy is that they qualified for the World Cup without playing a single qualifier at home. They should be very proud of their performances so far,analysis,,,
It's worth it to circumvent the stupid team A loses to team B and gets ahead because they beat team C by 6 goals whereas B beat them by only 3,analysis,,,
Tactically they tried interesting things and didn’t just sit back to park the bus. They just lacked quality in the final third to punish Scotland or ask questions of Brazil. ,analysis,,,
"Messi 5 goals, Ronaldo 0. Let's see how he responds 😂",reaction,,,
Messi has scored every single goal in Argentina's WC campaign so far.,analysis,,,
Alvarez showing why he only had 6 non-penalty goals in La Liga last season tho,analysis,,,
Complete control by Argentina. Austria gave up after half time.,analysis,,,
Mbappe is currently at 14 and has an additional 2+ world cups in him. He can catch him eventually,analysis,,,
"No one will catch 18 WC goals. Too far ahead.


",hot take,,,
"Wow that result is pretty harsh for Uzbekistan because they honestly looked great. Was really surprised

And damn what a rocket at the end! I wish they got that because 2-3 would’ve felt more fair",reaction,,,
" mean, if you are lautaro martinez or Julian alvarez and you get the ball, why not pass it to messi. I mean he is right there, and he is messi. They have gotten plenty of goals before, and they will do if they need to. I dont doubt their capabilities",analysis,,,
"At the end of 2012, Messi earned the dubious record (dubious because it's not a record and nobody cared before or since) of scoring the most goals in a calendar year with 91.",hot take,,,
Colombia have two of the top 3 so far IMO.,hot take,,,
